stream,metric,value,audit_question
primary_real_adapter_obligations,primary_evaluated_obligations,15840,Do real local adapters execute the counted law obligations?
invalid_transformation_rejections,rejected_invalid_transformations,3240,Can invalid transformations inflate the denominator?
unsupported_fragment_accounting,unsupported_transformations,360,Are unsupported language fragments visible rather than hidden?
seeded_semantic_drift_controls,seeded_mutant_rows,36960,Does the oracle kill known semantic-drift mutants?
minimized_counterexample_replay,minimized_counterexamples,5040,Are failures reduced to replayable semantic slices?
bounded_core_law_certificate,bounded_model_checked_cases,74024,Are law predicates checked against an executable core model?
native_fixture_selftests,native_selftest_rows,451,Are native-format benchmark files exercised before normalization?
