scope,resource_id,resource_name,version_or_scope,license_disposition,redistribution_status,evidence,status
runtime_dependency,bracex,bracex,2.6,MIT,vendored_with_license_file,vendor_python/bracex-2.6.dist-info/METADATA;LICENSE.md:489dc9f08b0642f513972086f256d6b0d80b415456b44b29e9ac7df744ad9156,PASS
runtime_dependency,cedarpy,cedarpy,4.8.3,Apache-2.0,vendored_with_license_file,vendor_python/cedarpy-4.8.3.dist-info/METADATA;LICENSE:cfc7749b96f63bd31c3c42b5c471bf756814053e847c10f3eb003417bc523d30,PASS
runtime_dependency,pycasbin,pycasbin,2.8.0,Apache 2.0,vendored_with_license_file,vendor_python/pycasbin-2.8.0.dist-info/METADATA;LICENSE:c71d239df91726fc519c6eb72d318ec65820627232b2f796219e87dcf35d0ab4,PASS
runtime_dependency,pypdf,pypdf,5.9.0,BSD-3-Clause,vendored_with_license_file,vendor_python/pypdf-5.9.0.dist-info/METADATA;LICENSE:a97ac230e5f33ef10a5367a850eb01f91f1a0b064e34742c7794d2294557f524,PASS
runtime_dependency,simpleeval,simpleeval,1.0.7,MIT,vendored_with_license_file,vendor_python/simpleeval-1.0.7.dist-info/METADATA;LICENCE:482b4c83a3f019088cf3739351565dccd6d475fce224eecccd0344bbd0b770dd,PASS
runtime_dependency,wcmatch,wcmatch,10.1,MIT,vendored_with_license_file,vendor_python/wcmatch-10.1.dist-info/METADATA;LICENSE.md:489dc9f08b0642f513972086f256d6b0d80b415456b44b29e9ac7df744ad9156,PASS
external_resource,E001,Open Policy Agent repository,OPA v1.17.1 context for the counted hash-gated CLI adapter,Apache-2.0 project license,Context plus checksum-gated backend; OPA rows enter the locked denominator only after pinning preflight passes.,The executable must match tools/opa_v1.17.1_linux_amd64_static.sha256 before any counted OPA row is observed.,PASS
external_resource,E002,OPA Policy Language documentation,official documentation context for Rego semantics,documentation terms; no page text redistributed,Citation/context only for adapter mapping; counted evidence comes from the pinned OPA executable and adapter/reference agreement rows.,No redistributed doc snapshot in packet; selected semantics are represented through adapter code and result ledgers.,PASS
external_resource,E003,OPA Policy Testing documentation,official documentation context for opa test behavior,documentation terms; no page text redistributed,Context only; opa test is not used as the LatticeGuard oracle baseline in the locked run.,No counted test rows depend on this page; counted OPA evidence uses opa eval with the pinned executable.,PASS
external_resource,E004,OPA pinned CLI checksum artifact,OPA v1.17.1 linux amd64 static executable and checksum recorded locally,Apache-2.0 project license,Executable is present and counted only after SHA-256 preflight; if absent or mismatched it is excluded before observing obligations.,tools/opa_v1.17.1_linux_amd64_static.sha256 is hash-replayed; executable must match before counted run.,PASS
external_resource,E005,Cedar repository,project context for Cedar language and engine,Apache-2.0 project license,Context for the Cedar ecosystem; counted adapter uses the pinned cedarpy package in requirements.txt.,Runtime evidence is the vendored cedarpy package metadata/license file and adapter/reference agreement ledger.,PASS
external_resource,E006,Cedar reference guide,official documentation context for Cedar PARC/authorization semantics,documentation terms; no page text redistributed,Semantic context for relation mapping; counted decisions use pinned cedarpy and reference agreement rows.,No redistributed doc snapshot in packet; source slices record URL/hash separately.,PASS
external_resource,E007,Cedar authorization decision rules,documented forbid-overrides-permit and default-deny context,documentation terms; no page text redistributed,Semantic context for deny/default-deny laws and Cedar adapter mapping.,Relevant source slices are represented by hashed normalized subjects and native fixtures.,PASS
external_resource,E008,Cedar project organization page,project context only,public project metadata; no page text redistributed,Background context only; not counted as experimental evidence.,No data hash required because the page is not used as corpus or runtime evidence.,PASS
external_resource,E009,CNCF Cedar project page,project-status context only,public page; no page text redistributed,Optional context only; not a counted result or evidence row.,No data hash required because the page is not used as corpus or runtime evidence.,PASS
external_resource,E010,Apache Casbin homepage,project context for Casbin multi-language authorization library,Apache-2.0 project license,Context only; counted adapter uses pinned pycasbin==2.8.0 from requirements.txt.,Runtime evidence is the vendored pycasbin package metadata/license file and adapter/reference agreement ledger.,PASS
external_resource,E011,Casbin overview documentation,official documentation context for Enforcer/model/policy abstraction,documentation terms; no page text redistributed,Semantic context for adapter mapping and public source slices.,Relevant source slices are represented by hashed normalized subjects and native fixtures.,PASS
external_resource,E012,Casbin model syntax documentation,documented request/policy/effect/model syntax context,documentation terms; no page text redistributed,Semantic context and source-slice origin for supported Casbin fragments.,Relevant source slices are represented by hashed native and normalized subject records.,PASS
external_resource,E013,Casbin Effector documentation,documented effect-combination context,documentation terms; no page text redistributed,Context for deny/allow combination and relation applicability.,No page text redistributed; counted decisions are adapter/reference agreement rows.,PASS
external_resource,E014,Casbin Priority Model documentation,priority/ordering context for unsupported-fragment exclusion,documentation terms; no page text redistributed,Used to justify excluding priority-sensitive fragments from unordered RO obligations.,Unsupported-fragment evidence is stored in adapter_exclusions.csv and rejections/coverage ledgers.,PASS
external_resource,E015,Casbin ABAC documentation,ABAC context only,documentation terms; no page text redistributed,Background only; locked counted fragment remains the normalized PARC/RBAC law core.,No counted ABAC expansion claim is made in the locked paper.,PASS
external_resource,E016,OASIS XACML 3.0 Core Specification,OASIS Standard 2013,OASIS document terms; no spec text redistributed,Background terminology for policy combining and access-control policy analysis.,No local spec copy is redistributed; citation integrity is handled by references.bib and reference_integrity_gate.,PASS
external_resource,E017,NIST SP 800-192,published NIST report for verification/testing guidance,NIST public report; no PDF redistributed,Cited background only for policy/model verification and testing motivation.,No local PDF redistributed; bibliography gate traces citation entry.,PASS
external_resource,E018,NIST SP 800-162,published NIST report for ABAC terminology,NIST public report; no PDF redistributed,Cited background only for attribute-based access-control terminology.,No local PDF redistributed; bibliography gate traces citation entry.,PASS
external_resource,E019,NIST Access Control Policy Tool project page,archived historical tool context,NIST page terms; no tool redistributed,Historical context only; not used as runnable baseline or counted adapter.,No runtime artifact is included; no denominator or baseline row depends on this resource.,PASS
external_resource,E020,Margrave project page/materials,historical access-control analysis context,page/material license not used for redistribution,"Historical context only; not a required baseline, adapter, or corpus source.",No package/material is redistributed; reference-integrity gate covers any citation use.,PASS
project_license,latticeguard_project_license,LatticeGuard artifact source license,anonymous submission artifact,MIT,included at artifact/LICENSE,artifact/LICENSE,PASS
